{
  "name": "callout",
  "files": [
    {
      "path": "callout.tsx",
      "content": "import * as React from \"react\"\nimport { cva, type VariantProps } from \"class-variance-authority\"\nimport { cn } from \"@/lib/utils\"\n\nconst calloutVariants = cva(\n  \"my-6 flex gap-3 rounded-lg border p-4\",\n  {\n    variants: {\n      variant: {\n        default: \"border-gray-700 bg-gray-900/50\",\n        info: \"border-blue-700 bg-blue-950/50\",\n        warning: \"border-yellow-700 bg-yellow-950/50\",\n        danger: \"border-red-700 bg-red-950/50\",\n        success: \"border-green-700 bg-green-950/50\",\n      },\n    },\n    defaultVariants: {\n      variant: \"default\",\n    },\n  }\n)\n\nexport interface CalloutProps\n  extends React.HTMLAttributes<HTMLDivElement>,\n    VariantProps<typeof calloutVariants> {\n  icon?: React.ReactNode\n  title?: string\n}\n\nexport function Callout({\n  className,\n  variant,\n  icon,\n  title,\n  children,\n  ...props\n}: CalloutProps) {\n  return (\n    <div\n      className={cn(calloutVariants({ variant }), className)}\n      {...props}\n    >\n      {icon && <div className=\"flex-shrink-0 text-white\">{icon}</div>}\n      <div className=\"flex-1\">\n        {title && (\n          <div className=\"mb-1 font-semibold text-white\">{title}</div>\n        )}\n        <div className=\"text-gray-300\">{children}</div>\n      </div>\n    </div>\n  )\n}\n"
    }
  ],
  "dependencies": ["class-variance-authority", "clsx", "tailwind-merge"],
  "registryDependencies": ["utils"]
}
