{
  "name": "inline-code",
  "type": "mdx",
  "description": "Inline code component for displaying code snippets within text",
  "files": [
    {
      "path": "inline-code.tsx",
      "type": "component",
      "content": "import * as React from \"react\"\nimport { cn } from \"@/lib/utils\"\n\ninterface InlineCodeProps extends React.HTMLAttributes<HTMLElement> {\n  children: React.ReactNode\n}\n\nexport function Code({ children, className, ...props }: InlineCodeProps) {\n  return (\n    <code\n      className={cn(\n        \"relative rounded bg-muted px-[0.3rem] py-[0.2rem] font-mono text-sm font-semibold\",\n        \"text-foreground\",\n        \"before:content-[''] after:content-['']\",\n        className\n      )}\n      {...props}\n    >\n      {children}\n    </code>\n  )\n}\n"
    }
  ],
  "dependencies": ["clsx", "tailwind-merge"]
}
